{
  "certificate_path": "C:/Users/jcgoo/Downloads/GARYCIS.pem",
  "issuer_path": "C:/Users/jcgoo/Downloads/GARYCISDHSCA4.cer",
  "ocsp_url": "http://ocsp.dimc.dhs.gov",
  "timestamp": "2025-10-23T08:41:29.369179",
  "return_code": 0,
  "signer_information": {
    "responder_id": null,
    "responder_id_type": null,
    "signature_algorithm": "sha256WithRSAEncryption",
    "signature_value": "b8843c3a09c53c5e8d9e404528cb43a531c1c30e0a97fe90730212d4b5e4f5db581a4174bdf6fee9cefbc8c9fb0563723b7596847f929c0458d5a38a670f64a1807347165241181474b68018f84810c8d4934d564129116f85119df63a8167f92533b97b14d2e0e92787ad57991037e1311cba3ff9cd2b3e966be673faacc7964c6bd447b3a35912a9a08129c3acb1a60ab387818d050dde40f228b1696391308ed8282caa9c8be247a950e390f92fb200d998694e8767b33f28a8d90bef3c7c81ac690d631690867a8f8edd4c3ddc90b6a8ec40e68efa7053107cc70b9c0e262800f5c1be5be232aed1d0391f04d8d8947e49a787c4074d3f6426ed4664c214Ce",
    "signature_verified": false,
    "verification_errors": [],
    "nonce_support": true
  },
  "certificate_status": {
    "status": "GOOD",
    "serial_number": "625E50AD",
    "revocation_time": null,
    "revocation_reason": null
  },
  "response_timestamps": {
    "this_update": "Oct 23 10:00:05 2025 GMT",
    "next_update": "Oct 24 10:08:35 2025 GMT",
    "produced_at": "Oct 23 10:08:35 2025 GMT"
  },
  "signature_information": {
    "signature_verified": false,
    "verification_method": "unknown",
    "verification_errors": [],
    "signature_algorithm": "sha256WithRSAEncryption",
    "signature_value": "b8843c3a09c53c5e8d9e404528cb43a531c1c30e0a97fe90730212d4b5e4f5db581a4174bdf6fee9cefbc8c9fb0563723b7596847f929c0458d5a38a670f64a1807347165241181474b68018f84810c8d4934d564129116f85119df63a8167f92533b97b14d2e0e92787ad57991037e1311cba3ff9cd2b3e966be673faacc7964c6bd447b3a35912a9a08129c3acb1a60ab387818d050dde40f228b1696391308ed8282caa9c8be247a950e390f92fb200d998694e8767b33f28a8d90bef3c7c81ac690d631690867a8f8edd4c3ddc90b6a8ec40e68efa7053107cc70b9c0e262800f5c1be5be232aed1d0391f04d8d8947e49a787c4074d3f6426ed4664c214Ce"
  },
  "responder_certificate": {
    "subject": null,
    "issuer": null,
    "serial_number": "1652246707 (0x627b48b3)",
    "validity_period": null,
    "public_key_algorithm": null,
    "key_usage": null,
    "extended_key_usage": null,
    "subject_alternative_name": null,
    "authority_key_identifier": null,
    "subject_key_identifier": null,
    "certificate_policies": null
  },
  "raw_stdout": "OCSP Request Data:\n    Version: 1 (0x0)\n    Requestor List:\n        Certificate ID:\n          Hash Algorithm: sha1\n          Issuer Name Hash: 002901F5AC8CBA7645BF553145069A496A51DA90\n          Issuer Key Hash: 53F400297CB45BE1320AB95AB5A1A47819AA89CB\n          Serial Number: 625E50AD\n    Request Extensions:\n        OCSP Nonce: \n            0410725EFF732AC5BC7FFFE101F3833A9C2E\nOCSP Response Data:\n    OCSP Response Status: successful (0x0)\n    Response Type: Basic OCSP Response\n    Version: 1 (0x0)\n    Responder Id: 65C1B77B4415E5D37F844739A727D6AD32B53D59\n    Produced At: Oct 23 10:08:35 2025 GMT\n    Responses:\n    Certificate ID:\n      Hash Algorithm: sha1\n      Issuer Name Hash: 002901F5AC8CBA7645BF553145069A496A51DA90\n      Issuer Key Hash: 53F400297CB45BE1320AB95AB5A1A47819AA89CB\n      Serial Number: 625E50AA\n    Cert Status: good\n    This Update: Oct 23 10:00:05 2025 GMT\n    Next Update: Oct 24 10:08:35 2025 GMT\n\n    Certificate ID:\n      Hash Algorithm: sha1\n      Issuer Name Hash: 002901F5AC8CBA7645BF553145069A496A51DA90\n      Issuer Key Hash: 53F400297CB45BE1320AB95AB5A1A47819AA89CB\n      Serial Number: 625E50AB\n    Cert Status: revoked\n    Revocation Time: Nov  4 13:45:05 2024 GMT\n    Revocation Reason: affiliationChanged (0x3)\n    This Update: Oct 23 10:00:05 2025 GMT\n    Next Update: Oct 24 10:08:35 2025 GMT\n\n    Certificate ID:\n      Hash Algorithm: sha1\n      Issuer Name Hash: 002901F5AC8CBA7645BF553145069A496A51DA90\n      Issuer Key Hash: 53F400297CB45BE1320AB95AB5A1A47819AA89CB\n      Serial Number: 625E50AC\n    Cert Status: good\n    This Update: Oct 23 10:00:05 2025 GMT\n    Next Update: Oct 24 10:08:35 2025 GMT\n\n    Certificate ID:\n      Hash Algorithm: sha1\n      Issuer Name Hash: 002901F5AC8CBA7645BF553145069A496A51DA90\n      Issuer Key Hash: 53F400297CB45BE1320AB95AB5A1A47819AA89CB\n      Serial Number: 625E50AD\n    Cert Status: good\n    This Update: Oct 23 10:00:05 2025 GMT\n    Next Update: Oct 24 10:08:35 2025 GMT\n\n    Certificate ID:\n      Hash Algorithm: sha1\n      Issuer Name Hash: 002901F5AC8CBA7645BF553145069A496A51DA90\n      Issuer Key Hash: 53F400297CB45BE1320AB95AB5A1A47819AA89CB\n      Serial Number: 625E50AE\n    Cert Status: good\n    This Update: Oct 23 10:00:05 2025 GMT\n    Next Update: Oct 24 10:08:35 2025 GMT\n\n    Certificate ID:\n      Hash Algorithm: sha1\n      Issuer Name Hash: 002901F5AC8CBA7645BF553145069A496A51DA90\n      Issuer Key Hash: 53F400297CB45BE1320AB95AB5A1A47819AA89CB\n      Serial Number: 625E50AF\n    Cert Status: good\n    This Update: Oct 23 10:00:05 2025 GMT\n    Next Update: Oct 24 10:08:35 2025 GMT\n\n    Certificate ID:\n      Hash Algorithm: sha1\n      Issuer Name Hash: 002901F5AC8CBA7645BF553145069A496A51DA90\n      Issuer Key Hash: 53F400297CB45BE1320AB95AB5A1A47819AA89CB\n      Serial Number: 625E50B0\n    Cert Status: good\n    This Update: Oct 23 10:00:05 2025 GMT\n    Next Update: Oct 24 10:08:35 2025 GMT\n\n    Certificate ID:\n      Hash Algorithm: sha1\n      Issuer Name Hash: 002901F5AC8CBA7645BF553145069A496A51DA90\n      Issuer Key Hash: 53F400297CB45BE1320AB95AB5A1A47819AA89CB\n      Serial Number: 625E50B1\n    Cert Status: good\n    This Update: Oct 23 10:00:05 2025 GMT\n    Next Update: Oct 24 10:08:35 2025 GMT\n\n    Certificate ID:\n      Hash Algorithm: sha1\n      Issuer Name Hash: 002901F5AC8CBA7645BF553145069A496A51DA90\n      Issuer Key Hash: 53F400297CB45BE1320AB95AB5A1A47819AA89CB\n      Serial Number: 625E50B2\n    Cert Status: good\n    This Update: Oct 23 10:00:05 2025 GMT\n    Next Update: Oct 24 10:08:35 2025 GMT\n\n    Certificate ID:\n      Hash Algorithm: sha1\n      Issuer Name Hash: 002901F5AC8CBA7645BF553145069A496A51DA90\n      Issuer Key Hash: 53F400297CB45BE1320AB95AB5A1A47819AA89CB\n      Serial Number: 625E50B3\n    Cert Status: good\n    This Update: Oct 23 10:00:05 2025 GMT\n    Next Update: Oct 24 10:08:35 2025 GMT\n\n    Certificate ID:\n      Hash Algorithm: sha1\n      Issuer Name Hash: 002901F5AC8CBA7645BF553145069A496A51DA90\n      Issuer Key Hash: 53F400297CB45BE1320AB95AB5A1A47819AA89CB\n      Serial Number: 625E50B4\n    Cert Status: good\n    This Update: Oct 23 10:00:05 2025 GMT\n    Next Update: Oct 24 10:08:35 2025 GMT\n\n    Certificate ID:\n      Hash Algorithm: sha1\n      Issuer Name Hash: 002901F5AC8CBA7645BF553145069A496A51DA90\n      Issuer Key Hash: 53F400297CB45BE1320AB95AB5A1A47819AA89CB\n      Serial Number: 625E50B5\n    Cert Status: good\n    This Update: Oct 23 10:00:05 2025 GMT\n    Next Update: Oct 24 10:08:35 2025 GMT\n\n    Certificate ID:\n      Hash Algorithm: sha1\n      Issuer Name Hash: 002901F5AC8CBA7645BF553145069A496A51DA90\n      Issuer Key Hash: 53F400297CB45BE1320AB95AB5A1A47819AA89CB\n      Serial Number: 625E50B6\n    Cert Status: good\n    This Update: Oct 23 10:00:05 2025 GMT\n    Next Update: Oct 24 10:08:35 2025 GMT\n\n    Certificate ID:\n      Hash Algorithm: sha1\n      Issuer Name Hash: 002901F5AC8CBA7645BF553145069A496A51DA90\n      Issuer Key Hash: 53F400297CB45BE1320AB95AB5A1A47819AA89CB\n      Serial Number: 625E50B7\n    Cert Status: good\n    This Update: Oct 23 10:00:05 2025 GMT\n    Next Update: Oct 24 10:08:35 2025 GMT\n\n    Certificate ID:\n      Hash Algorithm: sha1\n      Issuer Name Hash: 002901F5AC8CBA7645BF553145069A496A51DA90\n      Issuer Key Hash: 53F400297CB45BE1320AB95AB5A1A47819AA89CB\n      Serial Number: 625E50B8\n    Cert Status: good\n    This Update: Oct 23 10:00:05 2025 GMT\n    Next Update: Oct 24 10:08:35 2025 GMT\n\n    Certificate ID:\n      Hash Algorithm: sha1\n      Issuer Name Hash: 002901F5AC8CBA7645BF553145069A496A51DA90\n      Issuer Key Hash: 53F400297CB45BE1320AB95AB5A1A47819AA89CB\n      Serial Number: 625E50B9\n    Cert Status: revoked\n    Revocation Time: Jul 16 13:54:35 2024 GMT\n    Revocation Reason: affiliationChanged (0x3)\n    This Update: Oct 23 10:00:05 2025 GMT\n    Next Update: Oct 24 10:08:35 2025 GMT\n\n    Certificate ID:\n      Hash Algorithm: sha1\n      Issuer Name Hash: 002901F5AC8CBA7645BF553145069A496A51DA90\n      Issuer Key Hash: 53F400297CB45BE1320AB95AB5A1A47819AA89CB\n      Serial Number: 625E50BA\n    Cert Status: revoked\n    Revocation Time: Jul 16 13:54:36 2024 GMT\n    Revocation Reason: affiliationChanged (0x3)\n    This Update: Oct 23 10:00:05 2025 GMT\n    Next Update: Oct 24 10:08:35 2025 GMT\n\n    Certificate ID:\n      Hash Algorithm: sha1\n      Issuer Name Hash: 002901F5AC8CBA7645BF553145069A496A51DA90\n      Issuer Key Hash: 53F400297CB45BE1320AB95AB5A1A47819AA89CB\n      Serial Number: 625E50BB\n    Cert Status: revoked\n    Revocation Time: Jul 16 13:54:33 2024 GMT\n    Revocation Reason: affiliationChanged (0x3)\n    This Update: Oct 23 10:00:05 2025 GMT\n    Next Update: Oct 24 10:08:35 2025 GMT\n\n    Certificate ID:\n      Hash Algorithm: sha1\n      Issuer Name Hash: 002901F5AC8CBA7645BF553145069A496A51DA90\n      Issuer Key Hash: 53F400297CB45BE1320AB95AB5A1A47819AA89CB\n      Serial Number: 625E50BC\n    Cert Status: good\n    This Update: Oct 23 10:00:05 2025 GMT\n    Next Update: Oct 24 10:08:35 2025 GMT\n\n    Certificate ID:\n      Hash Algorithm: sha1\n      Issuer Name Hash: 002901F5AC8CBA7645BF553145069A496A51DA90\n      Issuer Key Hash: 53F400297CB45BE1320AB95AB5A1A47819AA89CB\n      Serial Number: 625E50BD\n    Cert Status: good\n    This Update: Oct 23 10:00:05 2025 GMT\n    Next Update: Oct 24 10:08:35 2025 GMT\n\n    Signature Algorithm: sha256WithRSAEncryption\n    Signature Value:\n        b8:84:3c:3a:09:c5:3c:5e:8d:9e:40:45:28:cb:43:a5:31:c1:\n        c3:0e:0a:97:fe:90:73:02:12:d4:b5:e4:f5:db:58:1a:41:74:\n        bd:f6:fe:e9:ce:fb:c8:c9:fb:05:63:72:3b:75:96:84:7f:92:\n        9c:04:58:d5:a3:8a:67:0f:64:a1:80:73:47:16:52:41:18:14:\n        74:b6:80:18:f8:48:10:c8:d4:93:4d:56:41:29:11:6f:85:11:\n        9d:f6:3a:81:67:f9:25:33:b9:7b:14:d2:e0:e9:27:87:ad:57:\n        99:10:37:e1:31:1c:ba:3f:f9:cd:2b:3e:96:6b:e6:73:fa:ac:\n        c7:96:4c:6b:d4:47:b3:a3:59:12:a9:a0:81:29:c3:ac:b1:a6:\n        0a:b3:87:81:8d:05:0d:de:40:f2:28:b1:69:63:91:30:8e:d8:\n        28:2c:aa:9c:8b:e2:47:a9:50:e3:90:f9:2f:b2:00:d9:98:69:\n        4e:87:67:b3:3f:28:a8:d9:0b:ef:3c:7c:81:ac:69:0d:63:16:\n        90:86:7a:8f:8e:dd:4c:3d:dc:90:b6:a8:ec:40:e6:8e:fa:70:\n        53:10:7c:c7:0b:9c:0e:26:28:00:f5:c1:be:5b:e2:32:ae:d1:\n        d0:39:1f:04:d8:d8:94:7e:49:a7:87:c4:07:4d:3f:64:26:ed:\n        46:64:c2:14\nCertificate:\n    Data:\n        Version: 3 (0x2)\n        Serial Number: 1652246707 (0x627b48b3)\n        Signature Algorithm: sha256WithRSAEncryption\n        Issuer: C=US, O=U.S. Government, OU=Department of Homeland Security, OU=Certification Authorities, OU=DHS CA4\n        Validity\n            Not Before: Sep 16 15:21:52 2025 GMT\n            Not After : Jan  1 04:59:00 2026 GMT\n        Subject: C=US, O=U.S. Government, OU=Department of Homeland Security, OU=Certification Authorities, OU=DHS CA4, CN=OCSP Signer 63345616\n        Subject Public Key Info:\n            Public Key Algorithm: rsaEncryption\n                Public-Key: (2048 bit)\n                Modulus:\n                    00:c4:9a:ae:6b:0c:9e:23:27:92:39:76:fa:f9:3a:\n                    5b:99:7a:91:f4:ad:54:b2:30:03:9a:71:cf:93:0b:\n                    2d:43:bd:cd:b3:5c:42:bd:9f:1a:25:3d:af:09:4b:\n                    1b:79:4b:82:f9:3a:6d:94:03:91:fd:55:4f:31:52:\n                    34:32:39:dc:9e:d7:7b:7b:f7:db:15:42:aa:a0:54:\n                    61:9c:32:17:06:4c:cd:4f:dd:15:ef:46:cf:b0:50:\n                    8a:ed:b9:a5:e7:ac:0f:9f:a7:c1:e8:60:da:d6:5b:\n                    10:74:5f:cb:65:8c:9d:5c:dd:5d:10:b2:a8:4b:d3:\n                    07:5b:71:04:c9:d0:04:d2:f7:5e:f6:5b:41:08:b0:\n                    59:65:0f:5c:9a:20:bd:74:56:b3:b2:43:43:91:36:\n                    ae:9d:78:47:27:cc:9d:2e:30:f6:82:df:c5:f4:03:\n                    73:8c:86:76:56:bb:a9:3f:ce:c7:87:cb:82:85:61:\n                    a8:a3:3f:d1:05:1c:4e:fb:8c:41:e7:d1:83:ea:4e:\n                    00:d8:b7:3b:c1:f4:f8:3d:b5:7f:19:22:98:33:ac:\n                    9a:09:56:af:42:6c:1a:66:1d:43:6f:a4:6e:1a:02:\n                    92:1b:ee:d7:4c:27:f8:fc:5d:d2:37:3c:13:ce:f9:\n                    12:2e:ae:97:36:91:de:d6:18:8c:e7:5a:d1:3e:90:\n                    28:eb\n                Exponent: 65537 (0x10001)\n        X509v3 extensions:\n            X509v3 Key Usage: critical\n                Digital Signature\n            X509v3 Certificate Policies: \n                Policy: 2.16.840.1.101.3.2.1.3.6\n                Policy: 2.16.840.1.101.3.2.1.3.7\n                Policy: 2.16.840.1.101.3.2.1.3.8\n                Policy: 2.16.840.1.101.3.2.1.3.13\n                Policy: 2.16.840.1.101.3.2.1.3.16\n                Policy: 2.16.840.1.101.3.2.1.3.17\n                Policy: 2.16.840.1.101.3.2.1.3.36\n                Policy: 2.16.840.1.101.3.2.1.3.39\n                Policy: 2.16.840.1.101.3.2.1.3.40\n                Policy: 2.16.840.1.101.3.2.1.3.41\n                Policy: 2.16.840.1.101.3.2.1.3.45\n                Policy: 2.16.840.1.101.3.2.1.3.46\n                Policy: 2.16.840.1.101.3.2.1.3.47\n                Policy: 2.16.840.1.101.3.2.1.5.10\n                Policy: 2.16.840.1.101.3.2.1.5.11\n                Policy: 2.16.840.1.101.3.2.1.5.12\n            Authority Information Access: \n                CA Issuers - URI:http://pki.dimc.dhs.gov/dhsca_ee_aia.p7c\n                CA Issuers - URI:ldap://ldap01.dimc.dhs.gov/ou=DHS%20CA4,ou=Certification%20Authorities,ou=Department%20of%20Homeland%20Security,o=U.S.%20Government,c=US?cACertificate;binary\n            X509v3 Extended Key Usage: \n                OCSP Signing\n            OCSP No Check: \n\n            X509v3 Subject Alternative Name: \n                DNS:OCSP Signer 63345616, email:pki_ops@fiscal.treasury.gov\n            X509v3 Authority Key Identifier: \n                18:2E:20:21:B3:C9:57:85:88:27:E7:8A:75:84:F3:73:C6:77:E3:09\n            X509v3 Subject Key Identifier: \n                65:C1:B7:7B:44:15:E5:D3:7F:84:47:39:A7:27:D6:AD:32:B5:3D:59\n            1.2.840.113533.7.65.0: \n                0...V10.0...0\n    Signature Algorithm: sha256WithRSAEncryption\n    Signature Value:\n        af:9c:26:19:18:f4:64:b8:95:f8:4a:8c:02:db:6d:2c:51:76:\n        c1:f2:a9:a0:1c:bc:bb:58:4f:f6:4a:66:3b:ae:91:30:0c:57:\n        fc:c8:39:a7:eb:7f:14:a2:7b:02:eb:fd:a3:30:01:7a:c0:17:\n        9a:a5:b4:72:b4:c0:43:94:d4:30:59:13:ad:63:9e:e9:14:9c:\n        5a:2d:24:21:45:31:61:38:85:59:4a:83:b2:bd:2e:ec:4c:94:\n        78:cb:81:7a:7f:bd:f3:d2:11:e7:37:ee:14:81:fb:0e:d6:9b:\n        15:0e:6e:86:d1:87:88:3f:01:f0:e3:cd:c1:72:85:18:67:1d:\n        41:c4:8e:45:bb:93:6c:1b:3f:96:ec:db:10:b2:18:78:b1:24:\n        bc:51:1b:e5:13:be:9f:32:56:be:e6:ed:b7:b1:15:98:f5:d7:\n        88:98:9e:72:43:e7:c7:cf:9a:4e:8e:48:66:0b:a4:3a:29:83:\n        c4:b4:f7:b4:af:e2:0b:55:e0:12:c1:cd:91:be:28:41:34:dd:\n        02:a0:11:55:0c:82:7b:73:56:ae:01:38:6f:9f:40:f4:0a:10:\n        27:4d:5e:eb:4c:11:c6:0a:db:66:84:b8:75:b5:30:67:4b:62:\n        c2:70:b0:8d:ab:10:65:22:fc:89:98:6b:83:34:19:5b:2c:1f:\n        bd:8c:03:45:81:a0:f0:d5:2b:fb:02:ab:a1:33:69:5d:ac:e3:\n        bc:84:b7:fe:30:cf:5a:f9:3c:41:27:ec:ef:84:03:d9:6c:05:\n        4b:61:da:e0:62:6c:34:c5:23:fd:f3:0f:db:f3:67:d7:a6:5e:\n        b6:1d:a2:e9:73:ac:cd:af:ee:55:a7:93:9d:dc:ef:52:7d:cd:\n        9c:6a:85:4f:c2:78:42:49:66:c9:fc:df:e7:0c:59:f1:81:0f:\n        41:df:4e:35:1d:aa:3f:49:f1:9f:44:b6:11:10:b0:35:ee:c1:\n        7a:07:98:b3:22:61:65:cd:02:f7:48:dd:17:41:18:45:dc:d3:\n        ea:e8:02:6c:f4:b0:7e:42:4f:03:3b:66:94:28:82:c3:da:a0:\n        98:17:74:4f:fa:33:90:c8:a2:d8:0c:c2:c7:c0:35:af:a8:72:\n        0e:77:11:e9:cf:79:64:63:cd:6b:b4:bd:fc:92:ed:0f:2f:15:\n        cb:87:82:57:53:8e:92:cc:46:95:d5:08:cf:4d:85:d4:aa:f8:\n        98:0e:d2:e1:98:c2:49:ce:0d:1b:fb:3c:98:ac:bc:b7:12:e9:\n        2b:10:09:2f:95:20:a0:c5:84:e2:dc:5e:e6:a9:76:1c:39:67:\n        e5:54:17:d6:9b:c2:f5:16:b6:69:4b:e9:e7:8e:a5:50:f1:2e:\n        8a:4b:f2:a0:cd:b7:ed:c0\n-----BEGIN CERTIFICATE-----\nMIIHZzCCBU+gAwIBAgIEYntIszANBgkqhkiG9w0BAQsFADCBhzELMAkGA1UEBhMC\nVVMxGDAWBgNVBAoTD1UuUy4gR292ZXJubWVudDEoMCYGA1UECxMfRGVwYXJ0bWVu\ndCBvZiBIb21lbGFuZCBTZWN1cml0eTEiMCAGA1UECxMZQ2VydGlmaWNhdGlvbiBB\ndXRob3JpdGllczEQMA4GA1UECxMHREhTIENBNDAeFw0yNTA5MTYxNTIxNTJaFw0y\nNjAxMDEwNDU5MDBaMIGmMQswCQYDVQQGEwJVUzEYMBYGA1UEChMPVS5TLiBHb3Zl\ncm5tZW50MSgwJgYDVQQLEx9EZXBhcnRtZW50IG9mIEhvbWVsYW5kIFNlY3VyaXR5\nMSIwIAYDVQQLExlDZXJ0aWZpY2F0aW9uIEF1dGhvcml0aWVzMRAwDgYDVQQLEwdE\nSFMgQ0E0MR0wGwYDVQQDExRPQ1NQIFNpZ25lciA2MzM0NTYxNjCCASIwDQYJKoZI\nhvcNAQEBBQADggEPADCCAQoCggEBAMSarmsMniMnkjl2+vk6W5l6kfStVLIwA5px\nz5MLLUO9zbNcQr2fGiU9rwlLG3lLgvk6bZQDkf1VTzFSNDI53J7Xe3v32xVCqqBU\nYZwyFwZMzU/dFe9Gz7BQiu25peesD5+nwehg2tZbEHRfy2WMnVzdXRCyqEvTB1tx\nBMnQBNL3XvZbQQiwWWUPXJogvXRWs7JDQ5E2rp14RyfMnS4w9oLfxfQDc4yGdla7\nqT/Ox4fLgoVhqKM/0QUcTvuMQefRg+pOANi3O8H0+D21fxkimDOsmglWr0JsGmYd\nQ2+kbhoCkhvu10wn+Pxd0jc8E875Ei6ulzaR3tYYjOda0T6QKOsCAwEAAaOCArgw\nggK0MA4GA1UdDwEB/wQEAwIHgDCB6wYDVR0gBIHjMIHgMAwGCmCGSAFlAwIBAwYw\nDAYKYIZIAWUDAgEDBzAMBgpghkgBZQMCAQMIMAwGCmCGSAFlAwIBAw0wDAYKYIZI\nAWUDAgEDEDAMBgpghkgBZQMCAQMRMAwGCmCGSAFlAwIBAyQwDAYKYIZIAWUDAgED\nJzAMBgpghkgBZQMCAQMoMAwGCmCGSAFlAwIBAykwDAYKYIZIAWUDAgEDLTAMBgpg\nhkgBZQMCAQMuMAwGCmCGSAFlAwIBAy8wDAYKYIZIAWUDAgEFCjAMBgpghkgBZQMC\nAQULMAwGCmCGSAFlAwIBBQwwgfMGCCsGAQUFBwEBBIHmMIHjMDQGCCsGAQUFBzAC\nhihodHRwOi8vcGtpLmRpbWMuZGhzLmdvdi9kaHNjYV9lZV9haWEucDdjMIGqBggr\nBgEFBQcwAoaBnWxkYXA6Ly9sZGFwMDEuZGltYy5kaHMuZ292L291PURIUyUyMENB\nNCxvdT1DZXJ0aWZpY2F0aW9uJTIwQXV0aG9yaXRpZXMsb3U9RGVwYXJ0bWVudCUy\nMG9mJTIwSG9tZWxhbmQlMjBTZWN1cml0eSxvPVUuUy4lMjBHb3Zlcm5tZW50LGM9\nVVM/Y0FDZXJ0aWZpY2F0ZTtiaW5hcnkwEwYDVR0lBAwwCgYIKwYBBQUHAwkwDwYJ\nKwYBBQUHMAEFBAIFADA8BgNVHREENTAzghRPQ1NQIFNpZ25lciA2MzM0NTYxNoEb\ncGtpX29wc0BmaXNjYWwudHJlYXN1cnkuZ292MB8GA1UdIwQYMBaAFBguICGzyVeF\niCfninWE83PGd+MJMB0GA1UdDgQWBBRlwbd7RBXl03+ERzmnJ9atMrU9WTAaBgkq\nhkiG9n0HQQAEDTALGwVWMTAuMAMCBDAwDQYJKoZIhvcNAQELBQADggIBAK+cJhkY\n9GS4lfhKjALbbSxRdsHyqaAcvLtYT/ZKZjuukTAMV/zIOafrfxSiewLr/aMwAXrA\nF5qltHK0wEOU1DBZE61jnukUnFotJCFFMWE4hVlKg7K9LuxMlHjLgXp/vfPSEec3\n7hSB+w7WmxUObobRh4g/AfDjzcFyhRhnHUHEjkW7k2wbP5bs2xCyGHixJLxRG+UT\nvp8yVr7m7bexFZj114iYnnJD58fPmk6OSGYLpDopg8S097Sv4gtV4BLBzZG+KEE0\n3QKgEVUMgntzVq4BOG+fQPQKECdNXutMEcYK22aEuHW1MGdLYsJwsI2rEGUi/ImY\na4M0GVssH72MA0WBoPDVK/sCq6EzaV2s47yEt/4wz1r5PEEn7O+EA9lsBUth2uBi\nbDTFI/3zD9vzZ9emXrYdoulzrM2v7lWnk53c71J9zZxqhU/CeEJJZsn83+cMWfGB\nD0HfTjUdqj9J8Z9EthEQsDXuwXoHmLMiYWXNAvdI3RdBGEXc0+roAmz0sH5CTwM7\nZpQogsPaoJgXdE/6M5DIotgMwsfANa+ocg53EenPeWRjzWu0vfyS7Q8vFcuHgldT\njpLMRpXVCM9NhdSq+JgO0uGYwknODRv7PJisvLcS6SsQCS+VIKDFhOLcXuapdhw5\nZ+VUF9abwvUWtmlL6eeOpVDxLopL8qDNt+3A\n-----END CERTIFICATE-----\nC:/Users/jcgoo/Downloads/GARYCIS.pem: good\n\tThis Update: Oct 23 10:00:05 2025 GMT\n\tNext Update: Oct 24 10:08:35 2025 GMT\n",
  "raw_stderr": ""
}